req_id,text,system,class,source
raw_0169,Recreation of Inventory Quantity Adjustment for the period of previous 30 days shall take no more than 30min.,ecommerce,pe,raw
raw_0170,The System shall utilize currently owned computer equipment.,field_service,o,raw
raw_0171,The System shall allow generation of Inventory Quantity Adjustment documents on demand.,ecommerce,f,raw
raw_0172,The System shall allow on demand generation of all Inventory Quantity Adjustment documents since certain point of time.,ecommerce,f,raw
raw_0173,The IQA subsystem shall take into account current inventory status and adjust inventory of substitutionary ingredients accordingly.,banking,f,raw
raw_0174,The System shall allow entering storing and modifying product formulas.,ecommerce,f,raw
raw_0175,Product formulas shall allow use of semi-products which have own formulas.,ecommerce,f,raw
raw_0176,Product formula ingredients shall allow defining substitutionary ingredients.,ecommerce,f,raw
raw_0177,Product formula substitutionary ingredients shall be entered automatically by the PFE subsystem.,ecommerce,f,raw
raw_0178,Formula substitutionary ingredients shall be kept in persisted order,ecommerce,f,raw
raw_0179,Product shall allow entering storing and modifying product menus used by POS terminals.,ecommerce,f,raw
raw_0180,PME Subsystem shall allow building product menus based on the list of products kept in the accounting system.,ecommerce,f,raw
raw_0181,PME Subsystem shall allow keeping submenus within menus and products within submenus in a managed and persisted order.,ecommerce,f,raw
raw_0182,PME Subsystem shall allow for a product to exist in more than one submenu,ecommerce,f,raw
raw_0183,The System shall generate Inventory Quantity Adjustment document based on product daily sales data and product formulas.,ecommerce,f,raw
raw_0184,The System shall generate Inventory Quantity Adjustment document automatically when daily Product Sales data is available.,ecommerce,f,raw
raw_0185,Customer shall be able to check the status of their prepaid card by entering in the PIN number in under 5 seconds.,ecommerce,pe,raw
raw_0186,System shall let existing customers log into the website with their email address and password in under 5 seconds.,field_service,pe,raw
raw_0187,System shall let customers cancel their account process shall take no longer than 2 minutes. Database will mark the account as inactive and user will not be able to log into the website.,banking,pe,raw
raw_0188,System shall let administrator de-activate a customer account in under 1 minute. Customer will no longer be able to access the website.,banking,pe,raw
raw_0189,The product should be able to be used by 90% of novice users on the Internet.,ecommerce,us,raw
raw_0190,Users should only have to navigate through a maximum of 4 pages to create an account with the website.,banking,us,raw
raw_0191,The product shall retain the customers buying preferences and information.,ecommerce,us,raw
raw_0192,The product shall be easy for customers with novice skills on the Internet to purchase and watch streaming movies. Customers should be able to purchase and watch a pre-determined movie in under 3 minutes.,ecommerce,us,raw
raw_0193,The product shall use symbols and words that are naturally understandable by users familiar with websites,ecommerce,us,raw
raw_0194,When purchasing a streaming movie or pre-paid card via credit card the processing time should have a maximum response time of 15 seconds.,banking,pe,raw
raw_0195,All credit card information will be secured on the server and only accessible by authorized Izogn administrators. Information will be encrypted in the database.,banking,se,raw
raw_0196,The website shall continue to operate if the payment gateway goes down.,banking,ft,raw
raw_0197,The product shall be expected to operate within the maximum maintenance budget for a minimum of 2 years.,ecommerce,mn,raw
raw_0198,Website must interface with the CyberSource API to process credit card transactions.,banking,o,raw
raw_0199,Izogn Administrator must be able to update the category listings on the website within 2 minutes.,ecommerce,pe,raw
raw_0200,The product shall be able to be installed in the specified environment within 1 working day.,ecommerce,o,raw
raw_0201,Only registered customers can purchase streaming movies.,ecommerce,se,raw
raw_0202,A customer can only stream a movie if they purchased it and are within the 2 day viewing period.,ecommerce,se,raw
raw_0203,Only authorized personnel can access customer records in the database.,ecommerce,se,raw
raw_0204,All customer information will be stored on a secure database accessible only to authorized personnel.,ecommerce,se,raw
raw_0205,All credit card information will be encrypted in the database.,banking,se,raw
raw_0206,IzognMovies shall meet the licensing requirements set forth by the appropriate organizations in order to stream African movies.,ecommerce,l,raw
raw_0207,Website shall request and authorize credit card payment before allowing a user to stream a movie.,banking,f,raw
raw_0208,shall be able to stream purchased movie via Windows Media Player for up to 2 days aftere purchase date.,ecommerce,f,raw
raw_0209,Website shall allow customers to add their own movie review for a selected movie.,ecommerce,f,raw
raw_0210,Website shall allow the Izogn administrator to approve a review posted by a customer.,ecommerce,f,raw
raw_0211,Website shall allow customers to purchase pre-paid cards of $5 $10 or $20 value either by credit card or mail-in payment option.,banking,f,raw
raw_0212,System shall allow users to update their billing and contact information via the My Account section of the website.,banking,f,raw
raw_0213,Only registered customers can purchase streaming movies.,ecommerce,f,raw
raw_0214,Movies can only be streamed if the customer has purchased a movie and is within the 2-day time period to stream the movie.,ecommerce,f,raw
raw_0215,All registered customer information shall be stored and maintained in the database even after the customer cancels their account.,banking,f,raw
raw_0216,For leads that process longer than 25 seconds the system will record the event and duration,healthcare,pe,raw
raw_0217,The process must fit within the processing time conditions set forth by the Auto Rep Assignment process in which a lead is assigned within 3 minutes of the total life cycle.,education,pe,raw
raw_0218,Washing parameters will be updated during scheduled maintenance hours.,field_service,mn,raw
raw_0219,The leads washing functionality will return the lead data supplied to the vendor along with the reason of rejection.,ecommerce,f,raw
raw_0220,The product shall simulate the look of ships at sea.,ecommerce,lf,raw
raw_0221,The product shall display the grids within a circle as a view from a periscope.,ecommerce,lf,raw
raw_0222,The product shall display each type of ship in a grid using an image of the specific type of ship.,ecommerce,lf,raw
raw_0223,When the offensive player takes a shot the product shall simulate the sound of a ship at sea.,ecommerce,lf,raw
raw_0224,When a shot is marked as a miss the product shall simulate the sound of a shot missing its target.,ecommerce,lf,raw
raw_0225,When a shot is marked as a hit the product shall simulate the sound of a shot hitting its target.,ecommerce,lf,raw
raw_0226,When a ship is sunk the product shall simulate the sound of a sinking ship.,ecommerce,lf,raw
raw_0227,The product shall be available 24 hours per day seven days per week.,ecommerce,a,raw
raw_0228,The product shall able to handle a large number of games simultaneously.,ecommerce,pe,raw
raw_0229,The product shall protect the identity of the players. The product shall provide players no access to information that might reveal the identity of another player.,ecommerce,pe,raw
raw_0230,The product shall be intuitive and self-explanatory. Nine out ten users shall be able to successfully complete a game with no training.,ecommerce,us,raw
raw_0231,The product shall be available to players who understand English Spanish and French. The product shall allow the user to select the language upon accessing the product.,ecommerce,us,raw
raw_0232,The product shall provide players no access to information that might reveal the identity of another player,ecommerce,se,raw
raw_0233,The product shall maintain a list of players.,ecommerce,f,raw
raw_0234,The product shall allow a user to identify himself or herself as a player.,ecommerce,f,raw
raw_0235,Once a game has been initiated the product shall make the players assigned to the game unavailable for selection from the list of players.,ecommerce,f,raw
raw_0236,The product shall allow a user to remove himself or herself from the list of players at any time.,ecommerce,f,raw
raw_0237,The product shall make inactive players unavailable for selection from the list of players.,ecommerce,f,raw
raw_0238,The product shall remove players who have been inactive for 24 hours from the list of players.,ecommerce,f,raw
raw_0239,The product shall allow a player to initiate a game by selecting another available player from the list of players.,ecommerce,f,raw
raw_0240,Once a game is initiated the product shall display a defensive grid to each player,ecommerce,f,raw
raw_0241,Once a game is initiated the product shall display an offensive grid to each player.,ecommerce,f,raw
raw_0242,The product shall prevent a player from viewing the offensive or defensive grids of the other player.,ecommerce,f,raw
raw_0243,Once a game is initiated the product shall allow each player to position their 5 ships on their respective defensive grids.,ecommerce,f,raw
raw_0244,The product shall allow a player to position ships horizontally on their grid.,ecommerce,f,raw
raw_0245,The product shall allow the player to position ships vertically on their grid.,ecommerce,f,raw
raw_0246,The product shall allow the player to position ships diagonally on their grid,ecommerce,f,raw
raw_0247,The product shall prevent the player from overlapping ships on their grid.,ecommerce,f,raw
raw_0248,When both players have positioned their 5 ships on their defensive grids the product shall define the status of each player for the first turn.,ecommerce,f,raw
raw_0249,For each turn the product shall identify one player as offensive status and one player as defensive status.,ecommerce,f,raw
raw_0250,The product shall maintain the status of each player for a turn either offensive or defensive.,ecommerce,f,raw
raw_0251,At the start of each turn the product shall notify each player of his or her status.,ecommerce,f,raw
raw_0252,For each turn the product shall allow the offensive player to define a shot.,ecommerce,f,raw
raw_0253,For each shot the product shall examine the defensive grid of the defensive player to determine whether the shot was a hit or miss.,ecommerce,f,raw
raw_0254,For each shot the product shall notify the players whether the shot was a hit or miss.,ecommerce,f,raw
raw_0255,For each shot the product shall mark the shot as a hit or miss on the defensive grid of the defensive player.,ecommerce,f,raw
raw_0256,For each shot the product shall mark the shot as a hit or miss on the offensive grid of the offensive player.,ecommerce,f,raw
raw_0257,When the hit results in sinking a ship the product shall notify the players that the ship was sunk.,ecommerce,f,raw
raw_0258,When the hit results in sinking a ship the product shall mark the ship as sunk on the defensive grid of the defensive player.,ecommerce,f,raw
raw_0259,When the hit results in sinking a ship the product shall indicate the type of ship sunk on the defensive grid of the defensive player.,ecommerce,f,raw
raw_0260,When the hit results in sinking a ship the product shall mark the ship as sunk on the offensive grid of the offensive player.,ecommerce,f,raw
raw_0261,If the shot was marked as a hit the product shall allow the offensive player to define a shot.,ecommerce,f,raw
raw_0262,If the shot was marked as a miss the product shall change the status of the offensive player to defensive,ecommerce,f,raw
raw_0263,If the shot was marked as a miss the product shall change the status of the defensive player to offensive,ecommerce,f,raw
raw_0264,The product shall continue to assign turns until the game is ended.,ecommerce,f,raw
raw_0265,The product shall end a game when a hit by the offensive player results in sinking the last of the defensive players ships which had not been previously marked as sunk.,ecommerce,f,raw
raw_0266,The product shall allow a player to end a game at any time during the game.,ecommerce,f,raw
raw_0267,When a game is ended the product shall notify the players that the game is ended.,ecommerce,f,raw
raw_0268,When a game is ended the product shall allow each player to identify himself or herself as an available player in the list of players.,ecommerce,f,raw
raw_0269,When a game is ended the product shall allow each player to remove himself or herself from the list of players.,ecommerce,f,raw
raw_0270,The product shall be internet browser independent.The product must run using Internet Explorer and Netscape Navigator.,ecommerce,mn,raw
raw_0271,The product shall ensure that only supervisors can advertise empty time slots.The product must ensure that supervisors are allowed to access advertise empty time slots.,ecommerce,se,raw
raw_0272,The product shall ensure that only supervisors can enter a callers schedule.The product must ensure that supervisors are allowed to access advertise empty time slots.,ecommerce,se,raw
raw_0273,The product shall ensure that only supervisors can view schedule of all callers.The product must ensure that supervisors are allowed to access advertise empty time slots.,ecommerce,se,raw
raw_0274,The product shall provide GUI based Monitoring Services.System Administrators shall monitor message exchanges will predict and determine problems and will also provide internal and external support.,ecommerce,lf,raw
raw_0275,The product shall comply with City of Chicago Application Development Guide Framework.Application Development Framework will provide structured Graphical User Interface.,ecommerce,lf,raw
raw_0276,The product shall provide Monitoring Services.The product shall be easy for System Administrators and DBAs to use after two weeks of usage.,ecommerce,us,raw
raw_0277,The product shall provide Error Tracking Services.The product shall help the System Administrators and DBAs to resolve transaction errors 99% of the time.,banking,us,raw
raw_0278,The product shall provide Portals.The product shall help System Administrators to analyze the transactions with ad-hoc reporting and KPIs (Key Performance Indicators),ecommerce,us,raw
raw_0279,The product shall provide Asynchronous Messaging.The product shall provide asynchronous messaging to enable parallel processing and reduce the overhead in communications,ecommerce,pe,raw
raw_0280,The product shall provide Multi-threading and Load Balancing.The product shall provide multi-threading technology as well as load balancing to overcome data load spikes and traffic.,ecommerce,pe,raw
raw_0281,The product shall process messages within 2 seconds.The product shall have a maximum message processing time of 2 seconds,ecommerce,pe,raw
raw_0282,The product shall poll the system for messages every second.The product shall poll the system for new messages at a maximum of every 1 second.,ecommerce,pe,raw
raw_0283,The product shall provide Dynamic Change Support and Transparent resource addition.The product shall support Transparent Resource addition and Dynamic Change support to provide scalability and avoid service interruptions of more than 1 day.,ecommerce,pe,raw
raw_0284,The product shall be available 99% of the time. Rationale: To avoid service interruption during busiest customer service response periods. The product shall be available 99.99% of the time for regular business days.,ecommerce,a,raw
raw_0285,The product shall be robust.The product shall have fault avoidance based on standards adoption.,ecommerce,ft,raw
raw_0286,The product shall be robust with fault tolerance.The product shall have fault tolerance by using recovery technique compensatory transaction and routing around failures.,banking,ft,raw
raw_0287,The product shall be able to process all transactions.The product shall process minimum of 1 million transactions per year.,ecommerce,sc,raw
raw_0288,The product shall be platform independent.The product shall enable access to any type of development environment and platform.,ecommerce,o,raw
raw_0289,The product shall interface CSR and Datastream.The product shall exchange messages between CSR and EAM on a real time basis without any direct interfaces between two systems.,ecommerce,o,raw
raw_0290,: The product shall continue to operate during upgrade change or new resource addition.The product shall be able to continue to operate with no interruption in service due to new resource additions.,ecommerce,mn,raw
raw_0291,The product shall be updated on a regular basis.The product will have a new major feature introduced every six months and quarterly maintenance releases every six months.,ecommerce,mn,raw
raw_0292,The product shall operate with every platform.The product shall accommodate any new technology without any change in its architecture.,ecommerce,mn,raw
raw_0293,The product shall have security.The product shall provide authentication and authorization.,ecommerce,se,raw
raw_0294,The product shall information Security. The product shall enable privacy by encryption WS-Security and Integrity Checking.,ecommerce,se,raw
raw_0295,The product shall have audit capabilities.The product shall store messages for a minimum of one year for audit and transaction tracking purposes.,banking,se,raw
raw_0296,The system shall be displayable on any work computer a CCR user may have. The system interface shall be formatted to display at 800 by 600 pixel resolution.,field_service,lf,raw
raw_0297,Each team owner will need to use a username and password in order to be authenticated to reach the team owners page,ecommerce,se,raw
raw_0298,The application shall be able to complete every user transaction within one fourth of a second of receiving the request over the network.,banking,pe,raw
raw_0299,The RFS system should be able to easily interface with the BDW environment in order to load the data.7 data files shall be received from the BDW and loaded into the RFS system within 3 hours one day prior to the start of budgeting process every year. The data will be as of October month-end. Test files (7) shall be loaded up to 5 times throughout the year from the BDW.,ecommerce,o,raw
raw_0300,The product must comply with the intranet page standards and requirements of ENET Securities. 95% of the product look & feel will be approved by the Architecture group prior to implementation. The remaining 5% will be corrected and approved within one month of product release.,ecommerce,lf,raw
raw_0301,The users should be able to easily use the system to successfully complete their budgets within the stipulated time for completion. With a week of training prior to product implementation 98% of the users shall complete their budgets within the stipulated time.,ecommerce,us,raw
raw_0302,The product interface should be fast. The response time of the product interface should not exceed 2 seconds 90% of the time. For 10% of the time the response time should not be more than 10 seconds.not be more than 10 seconds.,ecommerce,pe,raw
