req_id,text,system,class,source
raw_0000,The product shall be available during normal business hours. As long as the user has access to the client PC the system will be available 99% of the time during the first six months of operation.,ecommerce,a,raw
raw_0001,The product shall ensure that it can only be accessed by authorized users. The product will be able to distinguish between authorized and unauthorized users in all access attempts,ecommerce,se,raw
raw_0002,The product shall be intuitive and self-explanatory. : 90% of new users shall be able to start the display of Events or Activities within 90 minutes of using the product.,ecommerce,us,raw
raw_0003,The product shall respond fast to keep up-to-date data in the display.,ecommerce,pe,raw
raw_0004,The product shall have a consistent color scheme and fonts.,ecommerce,lf,raw
raw_0005,The product shall be easy for a realtor to learn.,ecommerce,us,raw
raw_0006,The product shall generate a CMA report in an acceptable time.,ecommerce,pe,raw
raw_0007,The product shall synchronize contacts and appointments in an acceptable time.,ecommerce,pe,raw
raw_0008,The product shall synchronize with the office system every hour.,ecommerce,pe,raw
raw_0009,The product shall be available for use 24 hours per day 365 days per year,ecommerce,a,raw
raw_0010,The product shall operate in offline mode whenever internet connection is unavailable.,ecommerce,ft,raw
raw_0011,The product shall allow the user to view previously downloaded search results CMA reports and appointments.,ecommerce,ft,raw
raw_0012,The product shall retain user preferences in the event of a failure.,ecommerce,ft,raw
raw_0013,The product shall be able to support multiple remote users,ecommerce,sc,raw
raw_0014,The product shall be able support 1000 simultaneous users.,ecommerce,sc,raw
raw_0015,The product shall be capable of handling the existing 1000 users. This number is expected to grow 5 times within the next year.,ecommerce,sc,raw
raw_0016,The product shall be installed by an untrained realtor without recourse to separately-printed instructions.,ecommerce,us,raw
raw_0017,90% of untrained realtors shall be able to install the product on their device without printed instructions,ecommerce,us,raw
raw_0018,The product is expected to run on Windows CE and Palm operating systems.,ecommerce,po,raw
raw_0019,The product shall prevent its data from incorrect data being introduced.,ecommerce,se,raw
raw_0020,The system shall be able to call the seller or buyer to schedule an appointment,healthcare,f,raw
raw_0021,The system shall notify the realtor when a seller or buyer responds to an appointment request,healthcare,f,raw
raw_0022,The product shall allow the user to save the property search results.,ecommerce,f,raw
raw_0023,The response time of general student management tasks shall take no longer than 5 seconds and the response time of schedule generation shall take no longer than 30 seconds.,education,pe,raw
raw_0024,The system shall be expected to manage the nursing program curriculum and class/clinical scheduling for a minimum of 5 years.,education,sc,raw
raw_0025,The system shall interface with the student master server.,education,o,raw
raw_0026,Program Administrators and Nursing Staff Members shall be able to add a single student to a cohort,education,f,raw
raw_0027,A non-clinical class shall specify the course name lecture room requirements and instructor needs.,education,f,raw
raw_0028,A clinical class shall specify the course name lecture room requirements clinical site needs lecture instructor needs and clinical lab instructor needs.,education,f,raw
raw_0029,A clinical lab section shall include the clinical site name the class instructor day and time of the lab.,education,f,raw
raw_0030,Program Administrators and Nursing Staff Members shall be able to add a student who has registered for a clinical class to a clinical lab section for that class.,education,f,raw
raw_0031,The system shall allow a Program Administrator or Nursing staff member to remove a student from a clinical lab section.,education,f,raw
raw_0032,The system shall allow a Program Administrator/Nursing Staff Member to move a student from one clinical lab section to another clinical lab section corresponding to the same clinical class.,education,f,raw
raw_0033,A Program Administrator/Nursing Staff Member shall be able to add a new nursing student to the system.,education,f,raw
raw_0034,A staff member shall have the ability to manage the progress of a part time student which includes modifying their sequence of classes and timeline of classes.,education,f,raw
raw_0035,The system shall be able to display a printable summary for individual clinical labs which will include (but not be limited to) class name class number lab section listing of students enrolled instructor day(s) time and location.,education,f,raw
raw_0036,The system shall be able to display a printable summary for individual nursing students which will include (but not be limited to) student name student ID admission date classes credits GPA and the cohort that the student is enrolled in.,education,f,raw
raw_0037,The system shall be able to display a printable summary of the system log.,field_service,f,raw
raw_0038,The system shall contain contact information (e-mail and phone number) for all people relevant to the system including (but not limited to) staff members students lecture instructors clinical lab instructors and clinical site administrators.,education,f,raw
raw_0039,The system will notify affected parties when changes occur affecting cohorts including but not limited to changes to the sequence for a cohorts program of study and changes to a given weeks schedule (lab cancelled this week due to instructor illness).,education,f,raw
raw_0040,The system will notify affected parties when changes occur affecting specific students including but not limited to changing a students status from full time to part time and moving a student to a different clinical section.,education,f,raw
raw_0041,Program Administrators/Nursing Staff Members shall have the ability to modify information relating to a Clinical Lab Section including the clinical site name the department/section for the lab the class instructor day and time of lab and contact information.,education,f,raw
raw_0042,Program Administrators/Nursing Staff Members shall have the ability to modify information relating to a Nursing Student including student ID student name phone number e-mail status (full time or part time) and program of study.,education,f,raw
raw_0043,100% of the cardmember and merchant services representatives shall use the Disputes application regularly after a 2-day training course.,education,us,raw
raw_0044,100% of cardmember services representatives shall be able to successfully create a dispute case on the first encounter after completing the training course.,education,us,raw
raw_0045,100% of merchant services representatives shall be able to successfully perform a follow up action on a dispute case on the first encounter after completing the training course.,education,us,raw
raw_0046,The Disputes application shall be available 24x7x365 with the exception of the following scheduled maintenance windows. Monday Saturday 3:00am to 4:00am EST Sunday 1:00amd to 5:00am EST,field_service,o,raw
raw_0047,The Disputes application shall interface with the Statement Database. The Statement Database provides the transaction details to the Disputes System. All transaction details must be obtained from the Statement Database,banking,o,raw
raw_0048,If a user account is revoked it can only be re-instantiated by the System Administrator.,banking,se,raw
raw_0049,Only the System Administrator shall be able to reset a revoked user logon account,banking,se,raw
raw_0050,The Disputes application must conform to the legal requirements as specified by Regulation E and Regulation Z that govern credit card disputes processing.,banking,l,raw
raw_0051,The Disputes System must allow the users to select disputable transactions (based on the age of the transaction) from a user interface and initiate a dispute (ticket retrieval request or chargeback notification) on the selected transaction.,banking,f,raw
raw_0052,The Disputes System will provide the user the ability to create or initiate a ticket retrieval request. As part of ticket retrieval creation process the system must prompt the user to enter all the required information to create the ticket retrieval request. The ticket retrieval request is a document that is sent to merchant inquiring the validity of a transaction.,banking,f,raw
raw_0053,The Disputes System must allow the user to create three unique types of ticket retrieval requests. The three types of ticket retrieval requests are (1) Request for original receipt (2) Request for a copy of the receipt or (3) Request for a portfolio. A portfolio consists of documentation that would provide proof of a purchase such as the documentation that is received from a car rental agency that is more than a sales receipt.,ecommerce,f,raw
raw_0054,The Disputes System must provide a confirmation to the user upon the creation of ticket retrieval request that contains the following information; the dispute case number the type of retrieval requested (copy original or portfolio) and the date that the merchant response is due.,field_service,f,raw
raw_0055,The Disputes System shall allow the user to create or initiate a chargeback request. The system must prompt the user to enter the required information to initiate a chargeback request. The chargeback request results in a printed chargeback notification that is sent to merchant indicating that their account will be charged back if no proof is provided that the disputed transaction is valid.,banking,f,raw
raw_0056,The Disputes System shall accurately provide a list of possible reason codes for a given transaction. The list of possible reason codes must be derived based on the type of transaction and the industry that the merchant belongs to according to the business rules defined for the Disputes System.,banking,f,raw
raw_0057,The Disputes System must provide Search functionality. The search method must include the ability to search by (1) the dispute case number (2) the merchant account number (3) the cardmember account number and (4) the issuer number. In addition to the above criteria the search functionality must further allow the user to limit the results of the search by a date range the type of dispute (ticket retrieval request or chargeback notification) the case status (open closed or all) and the dispute reason code.,banking,f,raw
raw_0058,The Disputes System shall record the name of the user and the date for any activity that creates or modifies the disputes case in the system. A detailed history of the actions taken on the case including the date and the user that performed the action must be maintained for auditing purposes.,healthcare,f,raw
raw_0059,The product must support Internet Explorer 5.5 and above.,ecommerce,o,raw
raw_0060,The product must support Mozilla Firefox 1.0 and above.,ecommerce,o,raw
raw_0061,The product shall interface with the Choice Parts System. This provides the feed of recycled parts data.,ecommerce,o,raw
raw_0062,The product shall run on the existing hardware for all environments.,ecommerce,o,raw
raw_0063,The product shall adhere to the corporate Architecture guidelines,ecommerce,o,raw
raw_0064,The product shall comply with corporate User Interface Guidelines,ecommerce,lf,raw
raw_0065,The product shall comply with corporate color scheme,ecommerce,lf,raw
raw_0066,The appearance of the product shall appear professional,ecommerce,lf,raw
raw_0067,The product shall be easy to use by Adjusters and Collision Estimators. 95% of Adjusters and Collision Estimators shall find the product easy to use.,ecommerce,us,raw
raw_0068,The product shall increase productivity of Collision Estimators. 80% of the Collision Estimators shall agree their productivity has increase within 1 month of using the product.,ecommerce,us,raw
raw_0069,Users shall feel satisfied using the product. 85% of all users will be satisfied with the product.,ecommerce,us,raw
raw_0070,The product shall be easy to learn by Adjusters and Collision Estimators. The product shall be learned with two days onsite training,ecommerce,us,raw
raw_0071,The user shall easily locate instructions while using the product. User help can be found within 90% of the system.,ecommerce,us,raw
raw_0072,The search for the preferred repair facility shall take no longer than 8 seconds. The preferred repair facility is returned within 8 seconds,field_service,pe,raw
raw_0073,The preferred repair facility ratings shall be saved within 5 seconds. The save shall occur within 5 seconds.,field_service,pe,raw
raw_0074,The product shall adhere to the corporate online availability schedule. The application is brought down only within 98% of the scheduled outages per the availability schedule.,ecommerce,a,raw
raw_0075,The product shall achieve a 98% uptime. The product shall not fail more than 2% of the available online time.,ecommerce,a,raw
raw_0076,The product shall be able to handle up to 1500 simultaneous users. The system shall perform with 1500 users as a time.,ecommerce,sc,raw
raw_0077,The product shall be able to handle 10 000 concurrent users within 2 years of the initial launch.,ecommerce,sc,raw
raw_0078,For estimators the product shall be able to be operated in a repair facility during dirty and noisy conditions.,ecommerce,o,raw
raw_0079,The product shall interface with the ChoiceParts system once per day at approximately 1:00 AM.,ecommerce,o,raw
raw_0080,The maintenance of the product will fall within the established corporate maintenance windows.,ecommerce,o,raw
raw_0081,The product shall be supported using the corporate support center.,ecommerce,o,raw
raw_0082,Product installations and upgrades shall be handled by the middleware technology team within established launch time frames.,ecommerce,o,raw
raw_0083,Only adjusters with a supervisor role can update preferred repair facility ratings. Users without the supervisor role cannot access the repair facility ratings.,field_service,se,raw
raw_0084,One insurance company shall not be able to view another insurance companys claim data.,healthcare,se,raw
raw_0085,The product shall free of computer viruses.,ecommerce,se,raw
raw_0086,The product must comply with Sarbanes-Oxley.,ecommerce,l,raw
raw_0087,The product shall comply with the estimatics laws relating to recycled parts usage.,ecommerce,l,raw
raw_0088,The product shall comply with insurance regulations regarding claims processing.,ecommerce,l,raw
raw_0089,The user shall search for the preferred repair facility using vehicle vehicle location and radius in miles,field_service,f,raw
raw_0090,The system shall locate the preferred repair facility with the highest ratings for the input criteria,field_service,f,raw
raw_0091,The adjuster shall enter the preferred repair facility on the estimate assignment.,education,f,raw
raw_0092,The adjuster shall be able to override the preferred repair facitlity on the estimate assignment.,education,f,raw
raw_0093,The preferred repair facility shall be returned to the user.,field_service,f,raw
raw_0094,The system shall return a list of repair facilities within the radius if the preferred repair facility cannot be determined.,field_service,f,raw
raw_0095,The adjuster shall review the collision estimate.,ecommerce,f,raw
raw_0096,The user shall select to view the preferred repair facility ratings.,field_service,f,raw
raw_0097,The current repair facility ratings shall be displayed to the user.,field_service,f,raw
raw_0098,The user shall select to save the preferred repair facility ratings.,field_service,f,raw
raw_0099,The preferred repair facility ratings shall be saved by the system.,field_service,f,raw
raw_0100,The product must work with most database management systems (DBMS) on the market whether the DBMS is colocated with the product on the same machine or is located on a different machine on the computer network.,ecommerce,o,raw
raw_0101,The product will function alongside server software on any operating system where the Java runtime can be installed.,ecommerce,o,raw
raw_0102,The product will require collaboration with a database management system (DBMS). The DBMS may be located on the same machine as the product or on a separate machine residing on the same computer network.,ecommerce,o,raw
raw_0103,The product must make use of web/application server technology. Open source examples include Apache web server Tomcat and the JBoss application server.,ecommerce,o,raw
raw_0104,A database management system such as Oracle DB2 MySql or HSQL will need to be integrated with the product.,ecommerce,o,raw
raw_0105,The product shall have a conservative and professional appearance.,ecommerce,lf,raw
raw_0106,The product shall make the users want to use it. 80% of the users surveyed report they are regularly using the product after the first 2 weeks post-launch.,ecommerce,us,raw
raw_0107,The product shall be easy to use. 90% of users will be able to successfully reserve a conference room within 5 minutes of product use.,ecommerce,us,raw
raw_0108,The product shall give users feedback when necessary. 80% of the users surveyed report that the product accurately confirms their actions.,ecommerce,us,raw
raw_0109,The product shall allow the user to select a chosen language from one of the target market countries.,ecommerce,us,raw
raw_0110,The product shall allow for customization of start page and views preferences.,ecommerce,us,raw
raw_0111,An employee will be able to successfully use the product within a few minutes. After informally navigating the product for less than 15 minutes users shall be able to successfully setup meetings and reserve conference rooms.,ecommerce,us,raw
raw_0112,The product shall use a standard navigation menu familiar to most web users.,ecommerce,us,raw
raw_0113,The product shall allow for intuitive searching of available conference rooms.,ecommerce,us,raw
raw_0114,The product shall conform to the Americans with Disabilities Act.,ecommerce,us,raw
raw_0115,Aside from server failure the software product shall achieve 99.99% up time.,ecommerce,a,raw
raw_0116,The product shall create an exception log of problems encountered within the product for transmission to our company for analysis and resolution.,ecommerce,ft,raw
raw_0117,The product shall be capable of handling up to 1 000 concurrent requests. This number will increase to 2 000 by Release 2. The concurrency capacity must be able to handle peak scheduling times such as early morning and late afternoon hours.,ecommerce,sc,raw
raw_0118,The product shall be able to process 10 000 transactions per hour within two years of its launch. This number will increase to 20 000 by Release 2.,ecommerce,sc,raw
raw_0119,The product shall be expected to operate for at least 5 years for each customer installation.,ecommerce,sc,raw
raw_0120,The product shall be used in office environments.,ecommerce,o,raw
raw_0121,The product must be able to interface with any HTML browser. The product shall transmit data between the user and the product without problems. The product shall display HTML properly in 80% of all HTML browsers tested (minimum is to test 8 browsers).,ecommerce,o,raw
raw_0122,The product must be able to interface with various database management systems. The product shall communicate successfully with the database management system on 100% of all transactions.,ecommerce,o,raw
raw_0123,The product must be able to interface with various email servers. The product shall be able to send email.,ecommerce,o,raw
raw_0124,The product shall be available for distribution via the Internet as a binary or ZIP file.,ecommerce,o,raw
raw_0125,The product shall be available for distribution as a packaged CD.,ecommerce,o,raw
raw_0126,The product will be available for licensing as a one-server two-five servers or five-or-more servers license.,ecommerce,o,raw
raw_0127,A new user must be able to be added to the system within 10 minutes. 90% of new users are able to log into the system within 10 minutes.,field_service,us,raw
raw_0128,The product must be designed using Design Patterns and coding best practices. 90% of maintenance software developers are able to integrate new functionality into the product with 2 working days.,ecommerce,mn,raw
raw_0129,The product must be highly configurable for use with various database management systems for the end users. 80% of end users are able to integrate new database management systems with the product without changing the product�s software code.,ecommerce,mn,raw
raw_0130,Maintenance releases will be offered to customers once a year. The releases shall take no longer than 5 minutes for 80% of the customer base to install.,ecommerce,mn,raw
raw_0131,The customer shall be able to easily integrate new building maps with the product throughout the products lifecycle. Integration of new maps with the product shall be possible with little to no support from product support staff.,ecommerce,mn,raw
raw_0132,The product shall be translated into foreign languages other than the target market countries languages in future releases. For each emerging target market it shall take no more than 5 days to configure the product for that market�s language.,ecommerce,us,raw
raw_0133,The product is expected to integrate with multiple database management systems. The product will operate with Oracle SQL Server DB2 MySQL HSQL and MS Access.,ecommerce,o,raw
raw_0134,The product shall be able to be installed in any operating environment within 2 days.,ecommerce,o,raw
raw_0135,The product shall ensure that only company employees or external users with company-approved user IDs may have product access. 100% of all logons shall be by either company employees or external users with company-approved user IDs.,ecommerce,se,raw
raw_0136,The product shall ensure that the databases data corresponds to the data entered by the user. Each conference room reservation in the system will contain the same information as was entered by the user.,ecommerce,se,raw
raw_0137,The product shall prevent the input of malicious data. The product and/or adjacent hardware/software systems data shall remain 100% uncorrupted each time malicious data is input into the product.,ecommerce,se,raw
raw_0138,The product and/or dependent databases/filesystems shall remain operational as a result of the input of malicious data. The product and/or dependent databases/filesystems shall not crash 100% of the time that malicious data is input into the product.,ecommerce,ft,raw
raw_0139,The product shall have the ability to receive automatic software updates as new threats emerge. 100% of customers will be able to receive automatic software updates transmitted to the installed product.,ecommerce,se,raw
raw_0140,The language of the product shall accommodate all of the target market countries. 90% of survey respondents from each target market country will find that the language of the product is acceptable.,ecommerce,sc,raw
raw_0141,The product shall be able to display calendar dates and times according to the users locale. 90% of survey respondents from each target market country will find that the date and time formatting of the product is correct.,ecommerce,us,raw
raw_0142,The product must be developed with the J2SE/J2EE programming language libraries,ecommerce,o,raw
raw_0143,The product shall record meeting entries.,ecommerce,f,raw
raw_0144,The product will notify employees of meeting invitations.,ecommerce,f,raw
raw_0145,The product shall have the ability to send meeting reminders to employees.,ecommerce,f,raw
raw_0146,The product shall assign the organizers contact information to each meeting they create.,ecommerce,f,raw
raw_0147,The product will record meeting acknowledgements.,ecommerce,f,raw
raw_0148,The product shall store new conference rooms.,ecommerce,f,raw
raw_0149,The product shall update existing conference rooms.,ecommerce,f,raw
raw_0150,The product will be able to delete conference rooms.,ecommerce,f,raw
raw_0151,The product shall be able to store new room equipment.,ecommerce,f,raw
raw_0152,The product will update existing room equipment.,ecommerce,f,raw
raw_0153,The product shall be able to delete room equipment.,ecommerce,f,raw
raw_0154,The product shall allow an organizer to invite other employees to meetings.,ecommerce,f,raw
raw_0155,The product shall record the transportation status of equipment reserved.,ecommerce,f,raw
raw_0156,The product shall display a map of the company building showing conference room locations.,ecommerce,f,raw
raw_0157,The product shall record updated meeting agendas.,ecommerce,f,raw
raw_0158,The product shall send a meeting confirmation to the meeting organizer.,ecommerce,f,raw
raw_0159,The product shall display room equipment according to search parameters.,ecommerce,f,raw
raw_0160,The product shall display conference rooms according to search parameters.,ecommerce,f,raw
raw_0161,The product shall record different meeting types.,ecommerce,f,raw
raw_0162,The product shall record all the equipment that has been reserved.,ecommerce,f,raw
raw_0163,The product shall notify building personnel of equipment transport requests.,ecommerce,f,raw
raw_0164,The product will allow priviledged users to view meeting schedules in multiple reporting views.,ecommerce,f,raw
raw_0165,The product shall be able to send meeting notifications via different kinds of end-user specified methods.,ecommerce,f,raw
raw_0166,The product shall have a customizable Look and Feel.,ecommerce,f,raw
raw_0167,The product shall have an intuitive user interface.,ecommerce,f,raw
raw_0168,The product will display an available status for unreserved conference rooms.,ecommerce,f,raw
